{
  "documentVersion": "vNext",
  "schemaVersion": "2",
  "domainLabel": "archmaker:manifest:v2",
  "catalogRef": {
    "namespace": "archmaker.core",
    "id": "desktop",
    "version": "1.0.0",
    "digest": {
      "algorithm": "sha256",
      "value": "1111111111111111111111111111111111111111111111111111111111111111"
    }
  },
  "targetRef": {
    "id": "archmaker-profile",
    "version": "0.1.0"
  },
  "producer": {
    "id": "archmaker-core",
    "version": "0.1.0"
  },
  "resolutionDigest": {
    "algorithm": "sha256",
    "value": "2222222222222222222222222222222222222222222222222222222222222222"
  },
  "effectiveSelections": [
    {
      "stepId": "archmaker.sys.kernel",
      "optionId": "archmaker.kernel.linux",
      "value": {
        "kind": "single",
        "optionId": "archmaker.kernel.linux"
      },
      "origin": "manual",
      "locked": false
    }
  ],
  "providedCapabilities": [],
  "requiredCapabilities": [],
  "conflicts": [],
  "contentDigest": {
    "algorithm": "sha256",
    "value": "3333333333333333333333333333333333333333333333333333333333333333"
  },
  "storagePlan": {
    "mode": "new-disk",
    "firmware": {
      "kind": "uefi",
      "provenance": "declared"
    },
    "partitionTable": "gpt",
    "partitions": [
      {
        "role": "esp",
        "sizeBytes": 2147483648,
        "layers": [
          {
            "kind": "fat32",
            "mountPoint": "/efi"
          }
        ],
        "plannedAction": "create"
      },
      {
        "role": "system",
        "sizeBytes": 0,
        "layers": [
          {
            "kind": "filesystem",
            "fs": "ext4",
            "mountPoint": "/"
          }
        ],
        "plannedAction": "create"
      }
    ],
    "bootArtifactStrategy": "uki-on-esp",
    "intentAcknowledged": true,
    "planStatus": "verification-pending"
  },
  "encryptionPolicy": {
    "kind": "none"
  },
  "browserPolicy": {
    "selectedBrowserIds": ["archmaker.app.zen"],
    "defaultBrowserId": "archmaker.app.zen"
  },
  "verification": {
    "planValidationStatus": "not-validated",
    "hardwareVerificationStatus": "not-verified",
    "bootCompatibilityStatus": "unknown",
    "capacityVerificationStatus": "unverified",
    "executionStatus": "not-executed"
  }
}
